{
  "$schema": "http://json-schema.org/draft-07/schema#",
  "$id": "https://ease-design/schemas/capability-pilot-source-evidence.schema.json",
  "title": "Retained native capability pilot source evidence",
  "type": "object",
  "required": [
    "kind",
    "version",
    "capabilityId",
    "pilotId",
    "sourceRepository",
    "sourceRevision",
    "sourceRevisionState",
    "runtimeScheme",
    "target",
    "verifiedEvidence",
    "sourceFiles",
    "knownFailures",
    "pendingWitnesses"
  ],
  "additionalProperties": false,
  "properties": {
    "kind": { "const": "design-os.capability-pilot-source-evidence" },
    "version": { "const": 1 },
    "capabilityId": { "type": "string", "minLength": 1 },
    "pilotId": { "type": "string", "minLength": 1 },
    "sourceRepository": { "type": "string", "minLength": 1 },
    "sourceRevision": { "type": ["string", "null"] },
    "sourceRevisionState": { "type": "string", "minLength": 1 },
    "runtimeScheme": { "type": "string", "minLength": 1 },
    "target": { "type": "string", "minLength": 1 },
    "verifiedEvidence": { "$ref": "#/definitions/nonEmptyStrings" },
    "sourceFiles": {
      "type": "array",
      "minItems": 1,
      "items": {
        "type": "object",
        "required": ["path", "sha256"],
        "additionalProperties": false,
        "properties": {
          "path": { "type": "string", "minLength": 1 },
          "sha256": { "type": "string", "pattern": "^[a-f0-9]{64}$" }
        }
      }
    },
    "knownFailures": { "$ref": "#/definitions/nonEmptyStrings" },
    "pendingWitnesses": { "$ref": "#/definitions/nonEmptyStrings" }
  },
  "definitions": {
    "nonEmptyStrings": {
      "type": "array",
      "minItems": 1,
      "items": { "type": "string", "minLength": 1 }
    }
  }
}
